{
  "abp_version": "1.0",
  "abp_id": "ABP-bf0afe15",
  "scope": {
    "contract_id": "CTR-DEMO-001",
    "program": "SEQUOIA",
    "modules": [
      "hiring",
      "bid",
      "compliance",
      "boe",
      "award_staffing",
      "coherence",
      "suite_readonly",
      "unified"
    ]
  },
  "authority_ref": {
    "authority_entry_id": "AUTH-033059a5",
    "authority_entry_hash": "sha256:521ae3f9e87b49dd954160ba859fe96205d15367c807bc96b8f6368e60d3d40c",
    "authority_ledger_path": "enterprise/artifacts/public_demo_pack/authority_ledger.ndjson"
  },
  "objectives": {
    "allowed": [
      {
        "id": "OBJ-001",
        "description": "Evaluate bid/no-bid for opportunity DEC-001"
      },
      {
        "id": "OBJ-002",
        "description": "Assess staffing readiness for contract execution"
      },
      {
        "id": "OBJ-003",
        "description": "Map compliance requirements to deliverables"
      },
      {
        "id": "OBJ-004",
        "description": "Generate basis-of-estimate pricing models"
      },
      {
        "id": "OBJ-005",
        "description": "Estimate award staffing allocation and costs"
      },
      {
        "id": "OBJ-006",
        "description": "Monitor claim coherence and drift signals"
      },
      {
        "id": "OBJ-007",
        "description": "Present read-only unified decision surface"
      },
      {
        "id": "OBJ-008",
        "description": "Export verifiable evidence packs from any module"
      }
    ],
    "denied": [
      {
        "id": "OBJ-D01",
        "description": "Modify sealed decisions",
        "reason": "Sealed artifacts are immutable per governance policy"
      },
      {
        "id": "OBJ-D02",
        "description": "Bypass ABP verification on export",
        "reason": "All EDGE exports must carry verified ABP"
      },
      {
        "id": "OBJ-D03",
        "description": "Alter coherence scores without re-evaluation",
        "reason": "Coherence values are derived from evidence chains"
      }
    ]
  },
  "tools": {
    "allow": [
      {
        "name": "seal_bundle",
        "scope": "DEC-001"
      },
      {
        "name": "sign_artifact",
        "scope": "DEC-001"
      },
      {
        "name": "replay_sealed_run",
        "scope": null
      },
      {
        "name": "verify_pack",
        "scope": null
      },
      {
        "name": "verify_abp",
        "scope": null
      },
      {
        "name": "gate_abp",
        "scope": null
      },
      {
        "name": "export_evidence_pack",
        "scope": "SEQUOIA"
      }
    ],
    "deny": [
      {
        "name": "authority_ledger_revoke",
        "reason": "Only reviewers may revoke authority grants"
      },
      {
        "name": "transparency_log_delete",
        "reason": "Append-only log cannot be truncated"
      }
    ]
  },
  "data": {
    "permissions": [
      {
        "resource": "decision_log.csv",
        "operations": [
          "read"
        ],
        "roles": [
          "Operator"
        ],
        "sensitivity": "internal"
      },
      {
        "resource": "sealed_runs/*",
        "operations": [
          "read",
          "write"
        ],
        "roles": [
          "Operator"
        ],
        "sensitivity": "confidential"
      },
      {
        "resource": "hiring_console/*",
        "operations": [
          "read",
          "write"
        ],
        "roles": [
          "Operator"
        ],
        "sensitivity": "confidential"
      },
      {
        "resource": "bid_console/*",
        "operations": [
          "read",
          "write"
        ],
        "roles": [
          "Operator"
        ],
        "sensitivity": "confidential"
      },
      {
        "resource": "compliance_matrix/*",
        "operations": [
          "read",
          "write"
        ],
        "roles": [
          "Operator"
        ],
        "sensitivity": "confidential"
      },
      {
        "resource": "boe_pricing/*",
        "operations": [
          "read",
          "write"
        ],
        "roles": [
          "Operator"
        ],
        "sensitivity": "confidential"
      },
      {
        "resource": "award_staffing/*",
        "operations": [
          "read",
          "write"
        ],
        "roles": [
          "Operator"
        ],
        "sensitivity": "internal"
      },
      {
        "resource": "coherence_dashboard/*",
        "operations": [
          "read"
        ],
        "roles": [
          "Operator",
          "Reviewer"
        ],
        "sensitivity": "internal"
      },
      {
        "resource": "evidence_packs/*",
        "operations": [
          "read"
        ],
        "roles": [
          "Operator",
          "Reviewer",
          "Auditor"
        ],
        "sensitivity": "public"
      }
    ]
  },
  "approvals": {
    "required": [
      {
        "action": "seal_decision",
        "approver_role": "Reviewer",
        "threshold": 1,
        "timeout_ms": null
      },
      {
        "action": "revoke_authority",
        "approver_role": "Admin",
        "threshold": 1,
        "timeout_ms": 86400000
      },
      {
        "action": "export_restricted_data",
        "approver_role": "Reviewer",
        "threshold": 1,
        "timeout_ms": 3600000
      }
    ]
  },
  "escalation": {
    "paths": [
      {
        "trigger": "gate_fail",
        "destination": "Reviewer",
        "severity": "warn",
        "auto": true
      },
      {
        "trigger": "authority_expired",
        "destination": "Admin",
        "severity": "critical",
        "auto": true
      },
      {
        "trigger": "abp_missing_on_export",
        "destination": "Reviewer",
        "severity": "critical",
        "auto": true
      },
      {
        "trigger": "coherence_drift_threshold",
        "destination": "Reviewer",
        "severity": "warn",
        "auto": true
      }
    ]
  },
  "runtime": {
    "validators": [
      {
        "name": "authority_envelope_complete",
        "when": "pre_action",
        "fail_action": "block",
        "config": {}
      },
      {
        "name": "policy_hash_matches",
        "when": "pre_action",
        "fail_action": "block",
        "config": {}
      },
      {
        "name": "abp_present_on_export",
        "when": "pre_action",
        "fail_action": "block",
        "config": {}
      },
      {
        "name": "abp_hash_valid",
        "when": "pre_action",
        "fail_action": "block",
        "config": {}
      },
      {
        "name": "drift_threshold",
        "when": "periodic",
        "fail_action": "escalate",
        "config": {
          "max_ds": 6
        }
      }
    ]
  },
  "proof": {
    "required": [
      "authority_ledger",
      "manifest",
      "pack_hash",
      "seal",
      "transparency_log"
    ]
  },
  "composition": {
    "parent_abp_id": null,
    "parent_abp_hash": null,
    "children": []
  },
  "effective_at": "2026-02-25T00:00:00Z",
  "expires_at": null,
  "created_at": "2026-02-25T00:00:00Z",
  "hash": "sha256:c01f3565f11678598e098083ab01d7fc429d985525756300f932f44eea722789",
  "delegation_review": {
    "triggers": [
      {
        "id": "DRT-001",
        "name": "recurring_drift_fingerprint",
        "condition": {
          "fingerprint_repeats": 3,
          "window_days": 14
        },
        "severity": "warn",
        "auto_open": true
      },
      {
        "id": "DRT-002",
        "name": "irreversible_action_blocked",
        "condition": {
          "blocked_count_gt": 5,
          "window_days": 7
        },
        "severity": "critical",
        "auto_open": true
      },
      {
        "id": "DRT-003",
        "name": "linkage_score_sustained_drop",
        "condition": {
          "overall_coherence_lt": 60,
          "consecutive_runs": 3
        },
        "severity": "critical",
        "auto_open": true
      },
      {
        "id": "DRT-004",
        "name": "assumption_expiry_breach",
        "condition": {
          "expired_claims_gt": 4,
          "window_days": 30
        },
        "severity": "warn",
        "auto_open": false
      }
    ],
    "review_policy": {
      "approver_role": "Reviewer",
      "threshold": 1,
      "timeout_ms": 604800000,
      "output": "abp_patch"
    }
  }
}
